Rapport,Résidence des Tilleuls — Réception,Client,Camille Bernard,Site,"12 rue Exemple, 75000 Villemodèle",Export,Liste des défauts
Généré,12/07/2026,Entreprise,Horizon Suivi de Chantier,Inspecteur,Élodie Martin,Papier,A4,Modèle,Preuves,Densité des photos,Étendue
Profil de l'entreprise,,Préréglage de mise en page,Axé sur les photos,Sections,Page de garde | Résumé | Index des réserves | Détails des réserves | Preuves photographiques | Validation | Avertissement

ID,Titre,Description,Zone,Catégorie / corps de métier,Gravité,Statut,Historique de révision,Responsable,Date d'échéance,Action requise,Note de résolution,Nombre de photos,Photo après travaux,Légendes des photos,Date de prise de vue,Emplacements des photos,SHA-256 de la preuve originale,SHA-256 de la photo rendue,Intégrité de la preuve,Nombre de photos annotées
KIT-001,Joint silicone incomplet derrière la crédence,Compléter le joint avant la remise des clés.,Cuisine,Finitions,Modérée,Ouvert,,Entreprise générale,11 juil. 2026,Entreprise générale doit corriger ce point (défaut) avant le 11 juil. 2026.,,1,Non,Discontinuité du joint relevée derrière la crédence.,2026-07-09T09:00:00.000Z,,159279d98a7adfa284871688329ae61cd8f9f8612d005447787748581eab4bcf,159279d98a7adfa284871688329ae61cd8f9f8612d005447787748581eab4bcf,Vérifié,0
BED-002,Trace sur le retour du placard,Préparer puis reprendre la finition.,Chambre principale,Peinture,Mineure,En cours,,Peintre,12 juil. 2026,Peintre doit terminer ce point (défaut) et fournir les preuves de clôture.,,1,Non,Trace visible sous un éclairage normal.,2026-07-10T09:00:00.000Z,,6aa458e81f19bc3ebd7628b6af048fdf47dc141335fdaf0fe3561d3a25251fc0,6aa458e81f19bc3ebd7628b6af048fdf47dc141335fdaf0fe3561d3a25251fc0,Vérifié,0
BAT-003,Extracteur d'air hors service,Contrôler l'alimentation et remettre en service.,Salle de bains,Électricité,Critique,Ouvert,,Électricien,13 juil. 2026,Électricien doit corriger ce point (défaut) avant le 13 juil. 2026.,,1,Non,L'extracteur ne démarre pas pendant l'essai.,2026-07-11T09:00:00.000Z,,2136a76d2077bad4a236c221e21668e2ecd66ab12a96a1f6db5c23497f35dba4,2136a76d2077bad4a236c221e21668e2ecd66ab12a96a1f6db5c23497f35dba4,Vérifié,0
HAL-004,Seuil de porte réparé,Réparation validée lors de la contre-visite.,Entrée,Menuiserie,Mineure,Résolu,,Menuisier,14 juil. 2026,Point (défaut) résolu ; conserver les preuves de clôture avec le rapport final.,Réserve levée après vérification.,1,Oui,Seuil après réparation.,2026-07-12T09:00:00.000Z,,e4ca61ec141f342b1d4a428120af7ddbd072017715a7baf61efd6c04ed055591,e4ca61ec141f342b1d4a428120af7ddbd072017715a7baf61efd6c04ed055591,Vérifié,0
GEN-005,Changement de teinte hors marché,La demande n'entre pas dans le périmètre signé.,Cuisine,Demande de modification,Mineure,Rejeté,,Client,15 juil. 2026,Point (défaut) rejeté ou hors périmètre.,,0,Non,,,,,,,0