Report,Cedar Ridge Apartment Turnover,Client,Morgan Lee,Site,"100 Example Way, Austin, TX 78701",Export,Punch List
Generated,7/12/2026,Company,Blue Ridge Field Services,Inspector,Jordan Reyes,Paper,Letter,Template,Evidence,Photo density,Expanded
Company profile,,Layout preset,Photo-forward,Sections,Cover | Summary | Issue index | Issue details | Photo evidence | Sign-off | Disclaimer

ID,Title,Description,Area,Category / trade,Severity,Status,Review history,Assignee,Due date,Action required,Resolution note,Photo count,Has after photo,Photo captions,Photo captured at,Photo locations,Original evidence SHA-256,Rendered photo SHA-256,Evidence integrity,Marked-up photo count
KIT-001,Open sealant joint at backsplash,Complete the sealant joint before owner turnover.,Kitchen,Finishes,Moderate,Open,,General contractor,"Jul 11, 2026","General contractor to correct this punch item by Jul 11, 2026.",,1,No,Open joint recorded during the turnover walk.,2026-07-09T09:00:00.000Z,,159279d98a7adfa284871688329ae61cd8f9f8612d005447787748581eab4bcf,159279d98a7adfa284871688329ae61cd8f9f8612d005447787748581eab4bcf,Verified,0
BED-002,Paint scuff at closet return,Prepare and touch up the marked surface.,Primary bedroom,Painting,Minor,In progress,,Painting trade,"Jul 12, 2026",Painting trade to complete this punch item and provide closeout evidence.,,1,No,Scuff visible under normal room lighting.,2026-07-10T09:00:00.000Z,,6aa458e81f19bc3ebd7628b6af048fdf47dc141335fdaf0fe3561d3a25251fc0,6aa458e81f19bc3ebd7628b6af048fdf47dc141335fdaf0fe3561d3a25251fc0,Verified,0
BAT-003,Exhaust fan does not start,Confirm power and replace the fan if required.,Bathroom,Electrical,Critical,Open,,Electrical trade,"Jul 13, 2026","Electrical trade to correct this punch item by Jul 13, 2026.",,1,No,Fan did not operate during functional testing.,2026-07-11T09:00:00.000Z,,2136a76d2077bad4a236c221e21668e2ecd66ab12a96a1f6db5c23497f35dba4,2136a76d2077bad4a236c221e21668e2ecd66ab12a96a1f6db5c23497f35dba4,Verified,0
HAL-004,Entry threshold finish repaired,Repair was reviewed during the closeout walk.,Entry,Doors,Minor,Resolved,,Finish carpenter,"Jul 14, 2026",Resolved punch item; retain closeout evidence with final report.,Repair complete and accepted.,1,Yes,Finished threshold accepted at reinspection.,2026-07-12T09:00:00.000Z,,e4ca61ec141f342b1d4a428120af7ddbd072017715a7baf61efd6c04ed055591,e4ca61ec141f342b1d4a428120af7ddbd072017715a7baf61efd6c04ed055591,Verified,0
GEN-005,Cabinet color request outside scope,Requested color change is outside the approved scope.,Kitchen,Change request,Minor,Rejected,,Owner,"Jul 15, 2026",Rejected or out-of-scope punch item.,,0,No,,,,,,,0